;text;option_1;option_2;option_3;option_4;rating
q42776;Have you ever fired a real gun?  For this question, pellet/BB/Nerf/paintball weapons do not qualify.  If so, which most closely describes the deadliest type you have fired?;No.;Rifle / carbine / pistol / shotgun.;Machine gun / fully automatic / assault weapon.;Tank gun / naval gun / anti-tank / other cannon.;
q60;Which describes you better?;Warm-hearted;Cool-headed;;;
q23779;How often are you influenced by peer pressure?;Often;Rarely;Sometimes;;
q337;Without using a dictionary or other tool, can you choose the commonly misspelled word? Don't cheat! It's okay if you don't know.;Separate;Definate;Committee;(Not sure / dumb question / who cares);
q52789;Which of the following do you consider to be the best explanation for the existence of human life on Earth?;Humans evolved from other species.;Humans were created by a higher power.;Humans were brought to Earth from the stars.;I'm not sure.;
q15749;Do you go to great lengths to avoid conflict?;Yes;No;;;
q86515;Do you enjoy conversation during breakfast?;Yes.;No.;Sometimes.;;
q50542;Have you ever yelled at the TV while watching sports?;Yes.;No.;;;
q93;Generally, in life, what makes you happier?;Quality;Variety;;;
q24496;When a dog licks your face, what is your reaction?;Ugh. Nasty.;Awww..how cute!;I'm Not Sure / Don't care;;
q64476;Under the right circumstances, would you allow a partner to lick your anus?;Yes.;No.;;;
q19145;Guys/girls who are tall and lanky:;Love it!;Hate it!;Don't particularly care;;
q161;Would you rather have more money or more freedom?;More money;More freedom;;;
q6238;Do you laugh when somebody trips and falls?;Yes, almost always;No, almost never;Occasionally;;
q232388;Have you stayed friends with most of your ex-boyfriends/ex-girlfriends?;I'm friends with all/most of them.;I'm friends with a few of them.;I'm not friends with any of them.;I don't have any ex-boyfriends/ex-girlfriends.;
q22706;Are you totally comfortable being naked around your lover, not just during sex?;Yes;No;;;
q1081;Would you prefer to be a financial success or to remain true to your principles?;Financial success, please.;I'll stick with my principles, thanks.;;;
q19458;Is it ok for a girl to ask a guy out on a date?;Yes, it's perfectly ok;Yes, but it comes across as desperate;No;;
q266;Do you have a favorite sports team that you really like to follow?;Yes;No;;;
q305;Goth chicks?;Sexy;Lame;I don't know;;
q27341;How does the thought of someone masturbating with you in mind make you feel?;Shocked;Disgusted;Flattered;Aroused;
q50178;Do you enjoy it when someone uses refrigerated items or ice cubes on you during sex?;Yes.;No.;I don't know.;;
q15550;What is too big of an age gap between you and a partner?;5 years;10 years;15 years;Age is just a number;
q42010;Do you make any special efforts to support small, independent businesses instead of the big chains?;Yes, I support the little guys whenever I can.;No, I prefer dealing with big business chains.;I support whoever has superior products/services.;This does not concern me at all.;
q45;Do you believe in ghosts?;Yes;No;;;
q18708;Which of the following best describes Science, in your opinion?;A belief system, no better or worse than Religion.;A method one can follow to make predictions.;A post-hoc explanation of God's miracles.;Hello? Like totally boring, dude.;
q215;Which would you rather master?;art;science;;;
q18;Do you have experience being in a slave/master relationship?;Yes;No;;;
q17705;Which of these cuisines is most appealing?;Thai;Indian;Italian;Mexican;
q60318;Would you enjoy going to an all night dance party?;Yes.;No.;;;
q216;Star Trek: cool or uncool?;Cool;Uncool;;;
q280;Do you like the taste of blood?;Yes;No;;;
q1305;Do you own your own country's flag?;Yes;No;;;
q49094;When it comes to art, do you prefer works that are abstract or representational?;Abstract.;Representational.;I like both kinds equally.;I'm not a big fan of art.;
q77456;If all of the professional sports leagues in the world ceased to exist, would you be upset?;Yes.;No.;;;
q49803;How often do you watch automobile racing?;Frequently.;Occasionally.;Never.;;
q1309;What size party would you prefer to attend?;Just a few close friends.;5-20 people.;20-100 people.;More than 100 people.;
q18433;You've been chatting with someone and are hitting it off. They e-mail you nude pictures of themselves. What's your reaction?;Very negative;Sort of negative;Sort of positive;Very positive, maybe even send nudes back;
q16295;To you, which adjective best describes hopeless, unrequited love?;Romantic;Foolish;Creepy;;
q214;Overall, has capitalism made the world a better place?;Yes;No;;;
q426;Do you enjoy watching movies with subtitles?;Yes;No;;;
q6542;Do you believe in the term 'meant to be'? As in fate or destiny with another person?;Yes;No;;;
q26367;Is there at least one nude photo of you on the Net?;Yes;No;Yes, but my face isn't visible;Not sure;
q84366;Suppose a close friend's partner is very attractive and thinks you're attractive, too. If you could enjoy a few hours of sex with them and your friend would never find out about it, would you do it?;Yes.;No.;Maybe.;;
q18711;Have you ever cosplayed? (Dressed up as a comic/anime character);Yes;No, and I wouldn't be interested;No, but it sounds cool;;
q23527;What type of humor do you enjoy most?;Ribald, crude, debasing;Witty, tongue-in-cheek;Slapstick, physical, farce;Sarcastic;
q19695;In general, are you a competitive person?;Very often;Sometimes / rarely;Never / not really;;
q22560;Which character best represents your personality?  (if you don't know/remember the characters, just go by the description);Garfield - apathetic & sarcastic;Bugs Bunny - creative & versatile;Batman - quiet problem-solver;Mickey Mouse - cheery & energetic;
q416;Would you and your ideal match eventually feel comfortable farting around each other?;Yes;No;;;
q61903;Would you be concerned if your partner still masturbated, even though you were sexually active together?;Yes;No;Maybe / I don't know;;
q53312;Which of the following would you be most disturbed to find in a 13-year-old child's room?;Condoms.;Illegal drugs.;Pornography.;Weapons.;
q35606;Does hanging out in an empty field, in the middle of no where, at 2am to watch a meteor shower sound like fun to you?;Heck yeah! I'll bring the hot cocoa/coffee/tea.;I've never done it but it sounds like fun.;I could take it or leave it.;Sounds like a complete waste of time.;
q41242;Your significant other is traveling and has the opportunity to stay with a good friend that you know they find to be very attractive.  What's your stance on the situation?;It would be totally unacceptable.;It might be ok, but I'd want to discuss it first.;It's fine - I don't see any problem.;It sounds sexy - Hopefully they'll hook up.;
q17808;Would you date someone purely on the fact that they were well endowed?;Yes;No;Depend on how 'well' we are talking!;;
q129;Do you have any 'extreme' piercings (this includes anything other than ears, nose, or navel)?;Yes;No;;;
q62537;Would you be willing to engage in mutual masturbation with someone?  You would be pleasing yourself and watching them do the same, but no touching each other.;Yes.;No.;;;
q467;Do you imagine you're louder than average (for someone your gender) during sex?;Yes, I'm louder;No;;;
q94;Are you almost always on time?;Yes;No;;;
q2781;Do you find it disturbing that products are still tested on animals?;Yes;No;;;
q84;Do you regularly go out partying on weeknights?;Yes;No;;;
q86750;What kind of rides do you like at amusement parks?;The biggest or most thrilling ones.;The more laid back, smaller, or classic rides.;I like them all, big and small.;I wouldn't bother to do the rides.;
q20838;My hair is usually...;Very well groomed.;Given a good combing.;Intentionally unruly or unkempt.;Left untouched.;
q60500;Has anyone ever accused you of being 'too clingy'?;Yes.;No.;;;
q29792;Do you like wearing formal attire?;Yes, I love dressing up.;Occasionally,  when I need to.;No / It makes me uncomfortable.;No opinion/Never had to;
q41696;If you had a dream in which you were having sex with a close friend, would you tell them about it?;Yes.;No.;It depends upon which friend.;;
q23477;Is the left or right hemisphere of your brain dominant?;Left (Science/Language/Logic/Reality);Right (Art/Philosophy/Emotion/Imagination);Both! My hemispheres are co-dominant!;I don't like this brain talk;
q168;The life of one of your fellow citizens is more valuable than the lives of ten foreigners.;True;False;;;
q16487;Do you dream of traveling the world or are you happy where you are?;Where's my ticket?;I'm fine where I am, thanks;;;
q6155;Are you a snob about some things?;Yes;No;;;
q56145;How do you generally feel about people who tend to hug others whom they've just met?;More positive than negative.;More negative than positive.;Indifferent.;;
q40319;Could you easily obtain illegal drugs through your social network?;Yes.;No.;Only marijuana.;;
q441;Do you make your bed most days?;Yes;No;;;
q82128;In general, how relaxed are you on a first date?;First dates make me nervous.;Maybe a few butterflies.;No worries.;;
q18825;Does it annoy you when an OkCupid user has no pictures that show their face?;Yes;No;;;
q18639;If your partner had a foot fetish, would you include it in your sex life?;Yes, for their sake;Yes, because I like it, too;No;;
q15756;Should sex education be taught in schools?;Yes;No;I don't know;;
q57307;Would the idea of a quiet evening sitting together reading books ever appeal to you?;Yes.;No.;;;
q78853;Would you like to play naked Twister with a group of people?;Yes.;No.;;;
q16269;Do you ever get inspired to make something creative for no reason in particular?;Very Often;Rarely / Never;Sometimes;;
q28777;Do you chew gum?;Yes;No;;;
q18538;Did you ever have a 'goth' phase?;No.;Yes, and I'm a little embarassed about it.;Yes, and I'm proud of it.;It wasn't a 'phase'!;
q34792;Would you be willing to date a musician?;Of course!;Possibly...depending on what they do.;I really don't know.;Not a chance!;
q22683;Can you sleep in the same room as someone who snores?;Yes;No;;;
q86049;How easily are you offended?;Very easily.;Somewhat easily.;Not very easily.;;
q14663;Do you only date people with athletic and toned bodies?;Yes;No;;;
q1222;In terms of relationships, which of these is it the most important to find?;Someone for whom you would do anything.;Someone who turns you on.;Someone you feel like you've known forever.;Someone with goals similar to yours.;
q12;Divide your age by 2.  Have you had sex with at least that many people?;Yes;No;;;
q71542;Which best describes the ideal indoor temperature for you?;Below 70F (21C);70-75F (21-24C);76-80F (25-27C);Above 80F (27C);
q13095;Do you kiss on the first date?;Under the right circumstance, Yes;Never;Always;;
q1263;Do you need to know about your partner's previous sexual exploits?;Yes, because it reflects on them as a person.;No, the past is the past.;;;
q40650;Do you and your ideal significant other enjoy making sarcastic jokes at each other's expense, knowing that it's all in good fun?;Yes! That's a personality trait we have to share.;Sometimes, but not too much.;No, sarcasm doesn't belong in a love relationship.;I can't dish it out, but I'd take it, I guess.;
q15409;Do you ever use the word 'gay' as an insult or pejorative?;Yes;No;;;
q24153;When I go out to eat, I go to a large chain restaurant:;Exclusively;Sometimes;Once in a while;Never;
q54;Which, on you, is closest to perfection?;Your mind;Your body;Your wallet;Your soul;
q80928;Have you ever seriously questioned your sexuality and whether it was different from what you first assumed?;Yes, and it changed.;Yes, but it did not change.;No.;;
q70586;Would you ever use paper plates just to avoid doing dishes?;Yes.;No.;;;
q57731;Would you consider dating someone who is much kinkier than you are?;Yes.;No.;;;
q412;Is global warming a serious problem?;Yes;No;I don't know;;
q20408;Do you believe in an energy field that surrounds us that we can manipulate through reiki, acupuncture, chakra balancing, yoga, or some other system?;Yes, and I practice one/some of these.;Yes, but I don't practice any of these.;No, but I do practice one/some of these.;No, and I would never practice any of these.;
q66544;In a relationship, who do you prefer to be taller?;I like to be taller.;I like my partner to be taller.;I like us to be about the same height.;It doesn't matter to me.;
q15751;Should wealthier people pay higher taxes?;Yes;No;;;
q69943;Do you like large dogs?;Yes.;No.;;;
q49093;Wearing socks with sandals is:;Perfectly fine.;Utterly wrong.;OK sometimes.;Not a subject I have an opinion on.;
q132;Can you run a mile without stopping?;Yes;No;Yes - And More;;
q68185;Would you enjoy going fishing with your partner?;Yes.;No.;;;
q50352;If you were going away for two weeks, how far in advance would you start packing?;I would pack at least two days before I leave.;I would pack on the day before I leave.;I would pack on the same day I leave.;I would not pack at all.;
q24748;Would you date a comic book geek?;Yes;No;;;
q42120;Are you a 'double dipper'?  In other words, do you ever take a bite of food and then dip it back into a shared sauce or dip?;Yes, I double dip indiscriminately.;Yes, but only with family or close friends.;Yes, but only with a partner.;No, never.;
q81847;Would you date someone who has cold-sores (oral herpes)?;Yes.;No.;;;
q142;Is it possible to love someone you don't even like?;Yes;No;;;
q6971;Is VERY short hair on a girl necessarily unattractive?;Yes;No;;;
q15182;Which is worse?;Someone who is always happy;Someone who is always sad;;;
q33;Do you like kissing in public?;Yes;No;;;
q617;If evil forces made you choose to either watch tv OR read books for the rest of your life, you would:;watch tv;read books;;;
q45645;Have you ever faked an orgasm during sex?;Yes.;No.;;;
q36666;Of these four educational subject areas, which is your favorite?;Language;Mathematics;Science;History;
q14853;How do you feel about baseball?;It's my life;I can take it or leave it;I think it's dumb;;
q365;How much would you enjoy hosting a big, crazy party?;A lot;Not that much;Not at all;;
q23389;You're out on the street and you encounter some people speaking a foreign language. What's your reaction?;You're in our country, speak our language!;No big deal.;Cool, what language are they speaking?;(in their language) Hi, how are you?;
q55185;In terms of birth order, which are you?;The oldest child.;The youngest child.;Somewhere in the middle.;All of the above.;
q898;Is it possible to have a true relationship, friend or otherwise, with someone you've never met in person?;Yes;No;;;
q18644;Does your ideal schedule involve staying up very late at night and sleeping during the day?;Yes;No;;;
q61133;Would you be comfortable masturbating in front of a partner?;Yes.;No.;I don't masturbate.;;
q1830;What makes a better friend?;Quick wit and a mischievous smile;Compassionate nature and a shoulder to support you;;;
q63068;Approximately how many hours per week do you dedicate to spiritual activity?;Zero.;One hour or less.;One to four hours.;More than four hours.;
q18619;Have you ever had a sexual relationship with someone you met online?;Yes;No;;;
q57718;Immediately after having sex with a partner, which of the following sounds most appealing?;Cuddling with them.;Doing my own thing.;Sleeping.;Masturbating or having sex again.;
q23233;Do you have time for a committed relationship in your life at this point?;Yes, absolutely;Probably not;No;;
q80621;How often do you smoke cigars?;Frequently.;Occasionally.;Never.;;
q13130;Hypothetically, do you think you would be good at being a porn star?;Yes;No;;;
q18763;Do you consider yourself to be an honorable person?;Yes, I always try to do the right thing.;Sometimes, it depends on the situation.;No, not really.;Are you kidding? I lie, cheat , AND steal.;
q29815;What do you think of reality television?;I love it!;It's alright.;I dislike it.;I have no opinion on reality television;
q48770;Would it ever be okay to break up with someone by email or text?;Yes.;No.;;;
q16820;What is your opinion on Walmart?;Retail heaven;Devil incarnate;Just another corporation;;
q27747;Do you believe that art and literature courses are important to students, even if they are majoring in other fields?;Yes, absolutely.;I like them, but don't know if they're important.;No, why waste their time?;;
q65043;Do you own any sexy underwear?;Yes.;No.;;;
q13100;Are you annoyed by tardiness?;Yes;No;I'm the one who's always running late.;;
q156917;Are you an Atheist?;Yes;No;;;
q605;Would you date someone who was looking for true love - but no sex, at all, ever?;Yes;No;;;
q35415;How would you feel if a significant other forgot your birthday, nameday, anniversary, or something else similarly important to you?;Indifferent.;Disappointed.;Annoyed.;Angry.;
q55980;Would you like to be the supreme ruler of all people on Earth?;Yes.;No.;;;
q19140;Personally, is sex in a public place hotter than indoor sex?;Yes;No;I'm Not Sure / Wouldn't know;;
q19125;Are you concerned with your image and the way others perceive you?;Very Much So;Often, yes;A little bit;Not at all / I hate the mainstream;
q19893;Is a tongue stud a turn-on?;Yes;No;;;
q59597;If given the chance, would you rather learn to play a musical instrument or learn to speak another language?;Play a musical instrument.;Speak another langauge.;Neither.;;
q20062;While in the middle of the best lovemaking of your life, if your lover asked you to squeal like a dolphin, would you?;Absolutely.;No way.;The best?  Maybe...;;
q68580;After dating someone for a while, you finally get to see where they live. He/she leaves you alone to go take a quick shower. Would you snoop?;Yes.;No.;;;
q512;Do you like to dance?;Yes;No;;;
q25734;What is the farthest you have/would go in a game of strip poker?;Underwear;Topless;All the way;Wouldn't even be playing.;
q17582;How are your teeth?;Perfect;Okay;Kinda Scraggly;Fucked Up;
q34;Are you more horny or more lonely?;Horny;Lonely;;;
q434;Do you like loud concerts?;Yes;No;;;
q22496;Board games?;What are board games?;I love boardgames, let's go play.;Boardgames are okay, I guess.;I'd rather do something else.;
q496;When a relationship ends, what's the best thing to do?;Try and be friends with your ex;Go your separate ways;;;
q49920;How spicy do you like your spicy food?;I like it extremely spicy.;I like it hot.;I like it a little spicy.;I prefer it be mild.;
q63;Which word describes you better?;Private;Social;;;
q53629;Which is your favorite season?;Summer.;Fall.;Winter.;Spring.;
q185;Are you really into Anime (Japanese Animation) movies?;Yes;No;;;
q38230;Would you really like to stay home and spend an entire day (24 hours) in bed (getting up only for the necessities) with your ideal significant other?;Yes.;No.;;;
q79635;How would you feel if someone called you 'good girl' or 'good boy' during sex?;Positive.;Negative.;Indifferent.;It would depend on which of the two I was called.;
q193;Do you say grace before meals?;Yes;No;;;
q91;Honestly, which do you do more of?;Watch television;Read;;;
q179;Who's smarter on average?;Men;Women;Neither, they're the same on average;;
q35995;Have you ever lied to a partner about your sexual history?;Yes;No;I've never discussed my sexual history in this way;;
q334;Do you usually wear cologne or perfume?;Yes;No;;;
q28478;If a blind date used a coupon while paying for dinner, how would you feel?;Negative. That's tacky/cheap.;Positive. Very sensible.;I don't care either way.;;
q54016;Are you afraid of falling madly in love?;Yes.;No.;;;
q1497;Which would you rather choose: peace on Earth or loads of money?;Peace on Earth;Loads of money;;;
q47635;Imagine you have a partner who is able to provide financially for you and any children.  Would you consider taking a stay-at-home role?;Yes.;No.;;;
q44540;If you were in a serious relationship, would you mind if your significant other maintained an active profile on OkCupid?;Yes - I would mind this.;No - This would not bother me.;;;
q23120;Which is most important to you in determining attractiveness?;Chest/Breasts;Butt/Legs;Face/Smile;Other;
q62455;Are you a workaholic?;Yes.;No.;;;
q20950;People who throw cigarette butts out of their car window...;Are not doing any real harm;Are being insensitive and/or rude;;;
q67418;What is your opinion of couples who frequently say 'I love you' to one another?;It's sweet.;It's annoying.;I'm indifferent to this.;;
q55355;Do you have a problem with people who wear fur clothing?;Yes.;No.;;;
q31898;How do you feel about zoos?;I think they're lots of fun!;Sure, they're fine.;Those poor, locked-up animals!;Zoos are boring.;
q23507;Could you date someone who never, ever, threw anything away?;Yes, junk is cool;No;I don't know;;
q45835;Which is your favorite weather?;Sun;Rain;Snow;Cloudy;
q18955;Would you date someone who's smart but achieved nothing in life?;Yes;No;;;
q29055;How do you feel about living with a signficant other before marriage?;Nothing wrong with that.;Maybe, depending on the situation.;I'm against that.;I'm not sure.;
q22534;Would you ideally like to be married within the next 3 years?;Yes;No;Possibly;I'm already married;
q39210;Do you believe you've lived past lives?;Yes, I am confident I have.;No, I do not believe this is possible.;Maybe, but there is no way to really know.;;
q15418;In your current music collection, do you have more independent artists or big name superstars?;Independent;Big name superstars;A mix of both;I don't have a music collection;
q577;How many dates does it take for a potential significant other to get a good sense of who you are as a person?;Less than five;More than five;;;
q19737;Could you live a life full of traveling?;Yes;No;;;
q486;Is a welfare system a good idea? Or does taxing for it just take money away from hard-working people who earned it?;Welfare is mostly good;Welfare is mostly bad;;;
q82301;When you first talk online with someone, which of the following would you prefer to talk about?;Sex.;Politics or current events.;Activities.;Personal history or experiences.;
q186;If you got married, would you change your name?;Yes;No;;;
q60145;Are you still in love with one or more of your former partners?;Yes - One of them.;Yes - More than one.;No.;No - I've never been in love with a partner.;
q70302;Of the following, which do you spend the most time doing while taking a bath or shower?;Washing and/or conditioning.;Shaving.;Relaxing.;Masturbating.;
q358;Do you know the first name of every person you've ever made out with?;Yes;No;;;
q17342;On a typical night, what time do you go to sleep?;By 9pm;By 11pm;By 1am;Later;
q15839;Do you often find yourself wanting to chuck it all and go to live on a sailboat?;Yes;No;;;
q28918;Would you do a striptease for your mate?;Yes;No;Maybe / Unsure;;
q64;Which is more important in a healthy relationship?;Maintaining privacy;Total openness;;;
q38912;How do you feel about germs?;Obsessed: I bleach anything I can't trust!;Careful: I wash my hands and cover my sneezes.;Polite: I always wash up when someone's watching.;Unconcerned: I don't actively lick doorknobs.;
q39714;Do you find the idea of shaving a partner's pubic hair exciting?;Yes.;No.;;;
q28902;Would you consider a serious relationship with someone who couldn't have or produce children?;Yes;No;;;
q9418;Manners are:;Important;Not very important;I fart on this question;;
q167;Do you recycle?;Almost always;Sometimes;Rarely or not at all;;
q23305;How many countries have you visited?;I have never left the country I live in now.;Between 2 and 5 countries.;Between 6 and 10 countries.;More than 10 countries.;
q42524;Would you ever consider having a friendship based primarily on sex, with no intentions for love, romance, or long-term commitment?;Yes.;No.;;;
q42918;What volume level do you usually prefer when listening to music?;Loud or louder.;Somewhere in the middle.;Soft and in the background.;I prefer to not listen to music.;
q50483;Do you consider astrology to be a legitimate science?;Yes.;No.;;;
q42282;Some friends invite you to go camping where there are no showers, no toilets, and no services.  The only luxuries would be those you could carry in a pack on your back. Do you go?;Yes.;No.;;;
q84910;Would it bother you if someone you are dating has a lot of close friends of the opposite sex?;Yes.;No.;;;
q26529;Have you ever taken any pills hoping they would help you lose weight?;Yes;No;;;
q39576;How important is it for you to give expensive gifts on a regular basis when in a relationship?;Very important.;Somewhat important.;Not at all important.;;
q392;If someone you barely knew asked you how many people you'd had sex with, would you answer?;Yes;No;;;
q27;Which is a bigger deal for you?;Telling someone you really care;Oral sex;;;
q55264;Do you think that a person's musical preferences are a good indicator of intelligence?;Yes.;No.;;;
q17168;Could you date someone who wasn't sure what they wanted to do with their life?;Yes;No;;;
q46176;Is it possible for someone to really be 'too nice'?;Yes.;No.;;;
q21986;Do you typically speak and write in a clear, precise manner?;Yes, almost always.;Yes, but only for classes/work.;It depends on my mood.;Ha, my language is vague and messy.;
q69912;Other things being equal, would you be more attracted to an artist or a scientist?;Artist;Scientist;;;
q84023;Could you live the rest of your life without drinking alcohol?;Yes.;No.;;;
q2;Breast implants?;more cool than pathetic;more pathetic than cool;;;
q13136;How important is art in your daily life?;Very Important;Somewhat Important;Not Important;I don't care;
q16371;Someone in an open relationship asks you out on a date. You:;Refuse / Aren't interested in open relationships.;Are hesitant, but would consider it.;Accept / Are open to non-monogamous relationships.;;
q27794;Would you date someone who was always optimistic?;Yes;No;;;
