;text;option_1;option_2;option_3;option_4;rating
q18966;Do you prefer hardcore or softcore when it comes to your porn?;Hard!;Soft!;Both!;I don't like porn;
q53402;Do you usually feel the need to shower or bathe after having sex?;Yes.;No.;I've never had sex.;;
q19919;Would you prefer to have one true love forever, or lots of fun and meaningful relationships?;One true love;Lots of relationships;;;
q33870;Would the fact that a partner insisted you were perfect (had no faults) and refused to acknowledge your shortcomings, bother you?;Yes;No;;;
q31821;Do you think the government should limit big chain stores to give small businesses a chance?;Yes;No;Maybe;Don't know/Don't care;
q35955;How would you feel if your significant other made more money than you?;Very comfortable;Somewhat comfortable;Somewhat uncomfortable;Very uncomfortable;
q26;Have you ever owned sex toys?;Yes;No;;;
q15478;Do you like hickies?;Yes;No;;;
q1387;Would you ever engage in a sexual activity you didn't enjoy, just because your partner did?;Yes;No;;;
q52827;Would you consider connecting with someone whose relationship status is 'seeing someone' or 'married'?;Yes to both;No to both;Yes to 'seeing someone' only;Yes to 'married' only;
q85823;How much would you dress up for a first date with someone you met on OkCupid?;I'd go all out.;I'd try to look nice.;I wouldn't wear anything special.;It would vary, depending upon their profile.;
q70218;You are interested in someone, and you discover that they were a nerd in high school.  How does this affect your opinion of them?;Favorably.;Unfavorably.;It makes no difference.;;
q366;When you're not in a serious relationship, what do you prefer?;Dating multiple people at once;Dating one person at a time;I only have serious relationships, I don't 'date';;
q53299;Which type of education would you prefer for your children?;Public.;Private.;Religious.;Home.;
q1158;Are you married, engaged to be married, or in a relationship that you believe will lead to marriage?;Yes;No;;;
q30723;Which is the greatest compliment you could receive?;That you are beautiful/sexy/hot;That you are intelligent;That you are talented;That you are extremely fun to be with;
q34517;Do you enjoy dark, violent, or disturbing music?;Yes;No;When I'm in the mood.;Unsure;
q382;Is long hair on a guy inappropriate?;Yes;No;;;
q19365;If you meet someone and they are everything you are looking for, except their body type, do you give them a chance?;Yes;No;;;
q7239;What is the worst personality trait someone can have?;Arrogance;Being boring;Immaturity;No sense of humor;
q763;Do you believe in karma?;Yes;No;;;
q54695;How clear to you are your goals in life?;Very clear.;Somewhat clear.;Not at all clear.;;
q23954;Do you ever feel the need to get really drunk?;Often;Sometimes;Rarely;Never;
q26052;Would you date someone who was very into fantasy novels?;Yes;Maybe;No, what a geek!;;
q85315;Have you been faithful in all of your past relationships?;Yes.;No.;I haven't had a past relationship.;;
q335;Do you (or would you) like to go hunting?;Yes;No;;;
q19011;Do you have a TV in your bedroom?;Yes;No;;;
q388;Is it easier to love or to hate?;Love;Hate;;;
q18547;Guys with facial hair;Great!;Okay.;Gross!;;
q30115;Have you ever gotten, or would you ever get, a piercing below the belt?;I have.;I would.;I wouldn't.;;
q62140;Does it bother you when people are late?;Yes, always.;No, never.;Sometimes, it depends upon the circumstances.;;
q54052;In general, how content are you with your own appearance?;Very content.;Somewhat content.;Not very content.;;
q171;What's more important to you?;Your world;Your country;;;
q13669;Would you date someone shorter than you?;Yes;No;;;
q17778;Are you a beer snob?;Yes;No;Not usually, but some beers I won't touch.;I don't drink.;
q23618;How important is it to you to have your own unique 'thing' (like a weekly Girls' Night Out or Guys' Movie Night) that you don't share with your partner(s)?;Very - I need some ME time to be happy;Sort of - I need friends outside of my partner;Not much - I like sharing stuff with my partner;I'd prefer not to have exclusive things;
q13032;Would you ever consider dating a Catholic?;Yes;Hesistant, but willing;No;Only if he/she was non-practicing;
q6040;Were you born the same gender as you are now?;Yes;No;;;
q86;Do you own a gun?;Yes;No;;;
q218;Should prostitution be legal?;Yes, absolutely;Yes, only if it were regulated;I don't think so;ABSOLUTELY NOT;
q15744;Are you a pet person?;Yes;No;;;
q15743;How do you feel about people with past addictions?;Completely uninterested;Extremely hesitant;A little hesitant;Totally fine;
q542;Roughly how many books have you read in the past year?;Less than five;Between five and fifteen;Between sixteen and fifty;Fifty or more;
q546;Would you date a transgender person?;Yes;No;;;
q48557;Do you find arrogance to be a turn-on?;Yes.;No.;;;
q49053;What was the duration of your longest romantic relationship?;More than five years.;One to five years.;Less than one year.;I've never been in a romantic relationship.;
q22125;Do you prefer?;Slim Men/Women;Average Men/Women;Fuller Figured Men/Women;I Don't Care/Not Fussy;
q538;Would you ever record a video of yourself having sex?;Yes;No;;;
q25294;Would you date someone who was currently in a relationship, knowing that you would 'be a secret?';Sure, why not?;Depends on the person.;Absolutely NOT.;;
q35520;Does netspeak (e.g., afk, brb, How RU?, lol, rotfl, ttyl, etc.) bother you?;Yes.;No.;Some of the time - It depends.;I don't know.;
q18125;Do you believe that there exists a statistical correlation between race and intelligence?;Yes;No;;;
q38173;Do you enjoy watching educational programming on television?;Yes, often.;Yes, on occasion.;No, never.;;
q26684;Are you the type of person to tell a homeless person to get a job?;Yes;No;;;
q354;Would you be comfortable being poor for the rest of your life?;Yes;No;;;
q20298;Compassion is:;A sign of strength;A sign of weakness;Neither;;
q1290;Do you feel like you're still hurting from something that happened to you a long time ago?;Yes;No;;;
q6111;Do overweight people annoy you?;Yes;No;;;
q1134;Do you have a desire (even if it's secret) to take part in sexual activities involving bondage?;Yes;No;Absolutely not.;;
q50564;Have your sexual interests become kinkier as you've grown older?;Yes.;No, they haven't changed much.;No, just the opposite.;No, I have no sexual interests.;
q209;Will you teach your children to believe in Santa?;Yes;No;;;
q18682;Do you think physical love is necessary for happiness in life?;Yes;No;;;
q64334;Imagine that your partner does not enjoy performing oral sex and refuses to ever perform it on you. How disappointed would you be?;Extremely disappointed.;Somewhat disappointed.;Slightly disappointed.;Not at all disappointed.;
q54127;Do you ever not feel like having sex because you feel too unattractive or too unappealing?;Yes, frequently.;Yes, sometimes.;Yes, but only rarely.;No, never.;
q499;Could you date someone who used anti-depressants?;Yes;No;;;
q50379;Imagine being all alone in the great outdoors, miles from anyone, with no communication device.  Nobody knows where you are.;This is something I would like.;This is something I would avoid.;;;
q6537;Could you live without the Internet?;Yes;No;;;
q126;What kind of shape are you in?;Great;Average;Shitty;;
q38838;Have you ever had sex with someone you first met online?;Yes.;No.;;;
q38320;Is it generally acceptable to you for a sex partner to initiate foreplay while you are sleeping?;Yes.;No.;;;
q155;Would you ever seriously date someone twice your age?;Yes;No;;;
q357;Which makes for a better first date?;Coffee and chit-chat;Drinks and groping;;;
q38196;Regardless of where you grew up or now live, which of the following best describes the way you see yourself at heart?;I am an urban or city person.;I am a suburbanite.;I am small town or country person.;;
q38423;What do you usually wear when you sleep?;Pajamas.;Underwear.;Nothing.;Something else.;
q9522;Would you date someone who has never been in any kind of relationship before?;Yes;No;;;
q48328;Do you believe that money can buy happiness?;Yes.;No.;;;
q60308;Say you're with someone you really care about, and they reveal their deepest, darkest secret. Which of the following would be most likely to scare you away?;A sexual fetish.;A bad temper.;A mild mental illness.;A history of bad credit.;
q5764;Sharing a toothbrush with your partner is:;Utterly disgusting;Okay, sometimes;A sign of closeness;;
q32657;Would you develop a new hobby/cultivate a new interest just to have something in common with your partner?;Sure, it's good to do stuff together;No, we should maintain our own identities;Maybe, but only if it seemed cool;;
q88;How messy are you?;I'm very messy;I'm average;I'm mostly organized;I'm compulsively neat;
q29389;I talk about my previous relationships:;All the time;Occasionally;Almost never, unless explicitly asked about them.;Never, even if explicitly asked about them.;
q1122;How often do you use profane language?;Never;Once in a while;Often;Almost always;
q20240;What is worse, being poor or alone?;Poor;Alone;;;
q48981;Consider the recent fictional movies you have watched.  Which of the following aspects do you find most disturbing?;Sex.;Violence.;Racial or cultural stereotyping.;None of the above disturbs me.;
q986;Do you believe in an afterlife/life after death/resurrection?;Yes;No;I'm Not Sure;;
q6347;Do you believe in miracles?;Yes;No;;;
q45598;Do you enjoy provoking people just to get a response.;Often.;Sometimes.;Never.;;
q294;Which is more important for a good match?;Having similar political beliefs;Having good sex;;;
q31983;Star Wars or Star Trek?;Star Wars;Star Trek;I can't decide.;Neither!;
q31488;If you were dating somebody that you met online, would you be reluctant to tell your friends?;Yes, I would be reluctant.;No, not at all.;A little, but I would be honest with them.;;
q71315;Do you like to leave music on while you sleep?;Yes.  I can't sleep without it.;Yes, but I don't need it to fall asleep.;No, but I can deal with it if my partner does.;No.  I can't sleep with music on.;
q234;Does fashion matter to you?;A lot;A little;Not at all;;
q26582;Would you ever eat something out of the trash?;Yes;Maybe (if it's still good);No;;
q39;Would you let your children under 13 watch movies with full nudity?;Yes;No;;;
q124;Do you work out a lot?;Yes;No;;;
q30830;Would you do something outrageous, stupid or adventurous simply because it would make a good story to tell later? (Assume there would be no serious consequences to your actions.);Yes, whenever possible.;Yes, but nothing too crazy.;Maybe, depends on what and who with.;No, and please don't run with scissors.;
q1375;Are geeks sexy?;Yes;No;;;
q7060;Are politics interesting?;Yes;No;Sometimes;;
q46780;Do you leave the lights on after leaving a room when they are no longer necessary?;Always - I don't think about turning lights off.;Usually - This isn't very important.;Sometimes - I try to save energy but do forget.;Rarely or never - That would be wasteful.;
q26405;Is it easy for you to achieve orgasm?;Yes, with skill and sometimes patience;Yes, any time the wind picks up;No, and I find it somewhat frustrating;No, but don't worry, I'm enjoying myself;
q33170;If/when you have NO pressing obligations (employment, schooling, children, errands, bedtime, or other factors aside), at what time do you prefer to get up in the morning?;Early bird gets the worm! I'm up before the sun!;Pretty Early (6:00ish - 9:30ish AM);I like to sleep in a bit. (9:30ish AM - Noonish);Morning? Curse that AM light! (afternoon or dark);
q41099;Right this minute, how clean is your main personal bathroom, (say the one you use every morning when you wake up in your own bed)?;Spotless, shiny, germ-free, clean clean clean.;Clean-ish but could use a quick touch-up.;Not awful, but it could use a good cleaning.;Disgusting! even I cringe when I have to use it!;
q6499;If I saw someone checking out my significant other, I'd feel:;flattered / proud;protective / concerned;unchanged;;
q38223;Do you like to go clubbing?;Yes, I prefer to go alone.;Yes, I prefer to go with a date.;Yes, I prefer to go with friends.;No.  I do not like to go clubbing.;
q76;Are you a morning person?;Yes;No;;;
q38051;How often do you gamble?;Often.;Rarely.;Never.;;
q82528;If you had your own private hot tub, would you go nude in it?;Yes, always.;Yes, but only when alone or with someone special.;Yes, but only when alone.;No, never.;
q40570;Is it more important to you that you are tactful, or truthful?;Tactful;Truthful;;;
q40288;How trusting are you where it concerns your government?;Completely.;Somewhat.;Not at all.;;
q13086;Would you date a single parent?;Yes;No;;;
q26299;What haircolor, or shade, do you prefer?;Dark (Black, Brown, Auburn);Light (Blonde, Light Brown, Red);Other (Neon, Obviously Dyed);I have no preference;
q665;Are you fetish-friendly?;Bring out the toys!;Never tried it, but I'm open-minded.;Not sure/don't know what they really are.;Ew!;
q156918;Do you practice Hinduism?;Yes;No;;;
q43304;Do you get angry when you lose a game?;Usually;Sometimes;Never;;
q40944;Do you have a checklist of mandatory traits that you absolutely require in any significant other?;Yes.;No.;;;
q86184;Do you keep your sexual exploits private?;Yes, always.;No, I am an open book.;Sometimes.;;
q24333;Are you squeamish about sharing food or beverages with the person you're dating?;Yes;No;Only at first;;
q44354;Do you enjoy long camping trips? (longer than 3 nights);I don't like to camp.;I've never camped, but would like to.;I like to camp, but not long trips.;I love long camping trips.;
q28754;How long do you believe people need to be in a relationship before before getting married?;At least 2 years;At least 1 year;At least 6 months;Less than 6 months / no requirement;
q48947;Is intoxication ever an acceptable excuse for acting stupid?;Yes.;No.;;;
q12584;Do you enjoy exercise?;Yes;No;;;
q24684;Do you carry condoms?;Always;Sometimes;Rarely;Never;
q36790;Let's say you are in line at a grocery store and have many items.  The person behind you just has only one or two.  Do you offer to let them go ahead of you?;Yes.  Always.;Yes, unless I am otherwise in a hurry.;No.  Never.;;
q2457;Does spending Friday or Saturday night at home annoy you?;Yes;No;;;
q30271;Does silence make you uncomfortable?;Yes;No;Depends on the situation;;
q12503;How often should your significant other buy you gifts, jewelry, or other things more expensive than, say, dinner, cards, or flowers?;Very frequently.;From time to time.;On special occasions (birthdays, Christmas, etc.).;Never.;
q32855;Underarms can be a hairy subject. How do you maintain your pits?;I let it grow, wild & free!;Occasionally I'll trim.;I shave consistently.;Whatever I feel like at the time.;
q44595;Tattoos on a woman's lower back area:;Sexy;Okay;Tramp stamps;Something I have no opinion on;
q25561;Does it bother you when people say 'PIN number' or 'ATM machine'?;Yes!;Well, a little;Nope, but I see why you're asking;Why would it?;
q19681;Are some sex acts with consenting adults inherently wrong or immoral?  Assume no unusual risk of injury.;Yes;No;;;
q307;Do you like wild parties?;Yes;No;;;
q82263;Would being in the same room with a couple of friends who are having sex bother you?;Yes.;No.;;;
q27672;Commitment to personal growth is:;For wimps.;Critically important.;Sort of important;;
q30384;How often do you wash your dishes?;As I use them.;Daily.;When I run out of clean utensils.;When the sink starts to smell funny.;
q73;Would you rather live in the big city or a small town?;Big city;Small town;;;
q156915;Are you a Buddhist?;Yes;No;;;
q86544;Which of the following has the biggest influence on your behavior?;Reason, Observation, Empiricism, Trial-And-Error.;Tradition, Faith, Upbringing, Heritage.;Emotion, Intuition, Instinct.;;
q82681;If I had to choose among the following for an ideal romantic partner, I'd choose:;Someone attractive and kind.;Someone smart and kind.;Someone attractive and smart.;;
q20818;Once you take a moral position, can anything be said or done to change your mind?;Yes, life is a big gray area anyway.;No, some things are just Right or Wrong.;Maybe. It depends on the issue.;Maybe, but it would take a lot.;
q213;Are some human lives worth more than others?;Yes;No;;;
q50755;Do you believe that everything happens for a reason?;Yes.;No.;;;
q18979;If you found out your partner was cheating on you, would you cheat on them in revenge?;Yes, they have it coming!;No, I'd confront them.;No, I'd dump them on the spot.;Maybe, if one of their friends is cute.;
q15742;How much do other people's opinions of you influence your decisions?;A lot;Some;Very little;Not at all;
q321556;How often do you masturbate?;Once a day or more;A few times a week;A few times a month;A few times a year or less;
q23132;Do you like to play drinking games?;Yes, they're totally sweet!;No, I think they're cheesy/lame;Not really, but I will on occasion;No, I don't drink;
q21793;How often do you try new things (food, activities, music, whatever) that you've never tried before?;Several times per week, or more.;Several times per month.;Several times per year.;Rarely or never.;
q34333;Which do you prefer in a significant other, generally speaking?;Dominance/Aggression;Submission/Shyness;A little of both, depending on the situation;;
q68401;Could you fall in love with someone you have only talked to online?;Yes.;No.;;;
q637;Have you ever had sex in a place where there was a high risk of being caught?;Yes;No, but it sounds like fun;No, I don't think I could do it;;
q16317;Would you ever date someone that is HIV positive?;Yes;No;I don't know;;
q75677;Which of the following character flaws would you be LEAST tolerant of in a potential partner?;Moodiness.;Dependency.;Jealousy.;Apathy.;
q309;Have you ever had a true one-night stand? (You met someone, had sex that night, and never contacted each other again.);Yes;No;;;
q35276;How much communication is ideal during sex?;A lot! It's all about the talk.;Just enough to get things right.;None. Shut up so I can concentrate.;;
q1173;Are you more attracted to virgins?;Yes;No;I AM a virgin;;
q83184;If your partner made a lot of noise while enjoying sex, would this be a turn-on or turn-off for you?;Turn on.;Turn off.;Either, depending upon how they sound.;It would make no difference.;
q1040;Receiving anal sex?;I like it / I think I might like it;I don't like it / I don't think I would like it;;;
q9628;Biting?;No;Yes;Let's break skin;;
q66827;During a romantic evening at your significant others' house, he or she puts on a slow song and asks you to dance. How would you respond?;Very romantic! I'm up for it!;I think its corny, but I'll do it anyway!;Not my kinda thing.;I'm not sure.;
q60901;If you were really, really drunk, which of the following would you be more likely to do?;Kiss someone.;Hit someone.;Complain to someone.;I'm not sure / I've never been really drunk.;
q6722;Which best describes your personal feelings about sports?;Sports are a very important part of my life.;I play or watch sports often.;I play or watch sports occasionally.;I don't watch or play sports.;
q463;In your ideal sexual encounter, do you take control, or do they?;I take control;They take control;;;
q52728;Which of these four is sexiest?;Someone who is good with language(s).;Someone who is logical or mathematical.;Someone who is physically skilled.;Someone who is musically skilled.;
q6867;Would you enjoy a night in playing video games?;Yes;No;;;
q1133;Do you have rape fantasies?;Yes;No;;;
q82566;Do you like coffee?;Yes.  I need it to function.;Yes, but I can do without it.;No.;;
q35475;When in a relationship, what importance do you place upon celebrating weekly or monthly anniversaries?;High.;Moderate.;Low.;None.;
q26720;How much do you spend per year for shoes?;Less than $100;$101 - $ 500;$501- $1000;More than a $1000;
q1049;Would you prefer the lights on or off during sex?;On;Off;It's exactly the same to me;;
q17457;Have you ever spent more than 8 hours straight playing video games?;Yes;No.;Anyone who does is a loser.;;
q48325;How important are academic achievements to you?;Very important.;Somewhat important.;Not important.;;
q21754;What is your opinion concerning strip clubs?;I would be there every day of the week if I could.;They can be fun every once and a while.;I do not really have an opinion/never been to one.;They're gross/disgusting/insulting/other.;
q153;Pick the best date on this list:;A really nice restaurant;A really divey bar;A day at the beach;;
q1172;Do you own any dice with more than six sides?;Yes;No;;;
q28545;When having sex, do you like to have your hair pulled?;Yes, and hard!;Yes, but gently.;No way.;Don't know / Not sure.;
q86909;Are you generally able to forgive and forget?;Yes.;No.;It really depends on the circumstances.;I can forgive, but I never forget.;
q220;Do you like to watch sports on television?;Yes;No;;;
q18212;How much do you usually tip a server who did a fine job?;Around 10% or less;10-15%;15-20%;Over 20%;
q15037;If someone asked you, 'What's the worst thing you've ever done?' would you know the answer right away?;Yes;No;;;
q30607;Is it okay to answer your cell phone while out with a friend or on a date?;Of course. Why wouldn't it be?;Friend, yes. Date, no.;No, that's just rude.;;
q27243;I find myself in fights with authority figures...;Often;Rarely / never;;;
q86417;How long can you go without sexual release?;A day or less.;More than a day, less than a week.;More than a week.;I have never had sexual release.;
q44384;Which best represents your opinion of same-sex relationships?;Girl-on-girl is okay, but guy-on-guy is wrong.;Guy-on-guy is okay, but girl-on-girl is wrong.;All same-sex relationships are wrong.;It's all fine by me.;
q30903;If you're in a relationship you expect will last for the rest of your life, is it important to you that it be the most satisfying sexual relationship you have ever had?;Yes;No;;;
q7077;Which is better: sex without sleeping together or sleeping together without sex?;Sex;Sleeping;;;
q11;How does the idea of being slapped hard in the face during sex make you feel?;Horrified;Aroused;Nostalgic;Indifferent;
q19075;Would you date someone who doesn't own a car?;Yes;No;;;
q15372;Could you date someone who has strong political opinions that are the exact opposite of yours?;Yes;No;;;
q1446;Do you care about other people's suffering?;Yes, solidarity is important;No, everyone has their own responsibility;It depends on the kind of suffering;;
q45006;Imagine you have a significant other who reveals they have a video of a sexual encounter from a prior relationship and offers to show it to you.  Would you want to see it?;Yes.;No.;;;
q81307;Have you ever had sex with a person within the first hour of meeting them?;Yes.;No.;;;
q1712;How shy would you say you are?;Very shy;Kind of shy;Not really shy;Not at all shy;
q106;Have you ever been married?;Yes;No;;;
q19392;Have you ever written something on the wall of a public toilet?;Yes;No;;;
q20981;Genital piercings:;Make me hot;Ouch, no thanks.;No opinion / Not sure;;
q38767;Is it okay for men to wear makeup?;Yes;No;;;
q30207;Is love overrated?;Yes, absolutely.;Yes, a bit.;No, it's fine.;No, it's underrated.;
q44;Some religions are more correct than others.;True;False;;;
q56606;How interested would you be in knowing the details of a partner's sexual history?;Very interested.;Somewhat interested.;Not interested.;;
q33602;Do you attempt to conserve water, energy or other resources during your everyday life?;Yes, almost always;Sometimes;No, I don't care;No, it's my right to waste as much as I want;
q48347;Do you think you could ever enjoy being humiliated as part of a sexual experience?;Yes;No;;;
q31374;Have you ever tried any sexual roleplaying, such as student/teacher or patient/nurse?;All the time. It really turns me on!;Yes, on occasion. I have to be in the mood.;No, but it sounds interesting.;No, and it isn't going to happen. Ever.;
q58812;Would you consider roleplaying out a rape fantasy with partner who asked you to?;Yes.;No.;;;
q275;Are you a virgin?;Yes;No;;;
q26573;Do you like going to poetry readings?;Yes;Sometimes;Occasionally / I'd try it;No;
q395;Is it okay for a girl to talk openly about her sexual exploits?;Yes;No;;;
q338;How does your maturity level compare with most people your age?;I'm more mature;I'm average;I'm less mature;;
q57717;Do you feel that having sex with someone you have known less than one year would be too soon?;Yes.;No.;;;
q69186;Can you remember the names of everyone you've ever had sex with?;Yes.;No.;I've never had sex with anyone.;;
q265;Who do you think was smartest on this list?;Einstein;Shakespeare;Mozart;Jesus;
q18843;Are you a good liar?;Yes;No;;;
q16862;Beards: cool or ugly?;Cool;Ugly;Depends;;
q67821;Would it bother you if your partner kept pictures of previous partner(s)?;Yes.;No.;;;
q531;Would you rather play Scrabble, go out dancing, or get drunk?;Scrabble;Dancing;Booze;;
q49107;Which of the following would you rather discuss with someone you just met?;Musical preferences.;Political beliefs.;Philosophical beliefs.;Sports.;
q20778;You're up against a nearly impossible challenge. Your ideal partner:;pushes you hard to succeed;reminds you to be realistic;stands back, but comforts you if you fail;;
q19854;Are sex and intimacy the same thing?;Yes;No;;;
q23147;Imagine you're having the perfect conversation with your ideal partner.  What are you doing?;Telling stories;Debating;Agreeing;Making plans;
q18594;Do superficial people, who place a high emphasis on physical appearance, annoy you?;Yes;No;Sometimes;;
q34094;Do you believe a couple should live together before considering marriage?;Yes;No;;;
q35862;When you are sleeping, do you prefer:;A cold room;A cool room;A warm room;A hot room;
