;text;option_1;option_2;option_3;option_4;rating
q61216;For the right person, how long do you think that you could sustain a long-distance relationship?;I couldn't do one, period.;One year or shorter.;More than one but less than three years.;Three years or longer.;3
q55344;Would it be a good idea to pass a law requiring people to take a course and pass a test before being allowed to have a child?;Yes.;No.;;;2
q19292;Have you ever taken a break while at work to 'play' with yourself ?;Yes;No;;;1
q46911;Have you ever heard a recording of your own voice?;Yes, I liked the sound of it.;Yes, but I did not like the sound of it.;No.;;1
q41711;Imagine you have a regular sex partner, but you cannot seem to help them achieve orgasm.  Would this bother you?;Yes.;No.;;;1
q79715;If all the commercial food sources in the world closed down, how would you provide for yourself and or family?;I'd hunt and / or fish.;I'd have a garden.;I'd do both of the above.;I'd do neither.  I'd prefer to starve.;2
q12229;Would you consider dating a divorced person?;Yes, definitely;I'd prefer not;Definitely no;;8
q494;Do you own a record player?;Yes;No;;;1
q22400;How many people have you kissed that are not related to you, in a more than friendly way?;0;1-10;11-50;51+;7
q66559;If you were in your last moments of life after a traffic accident, and someone from another faith was holding your hand attempting to comfort you in your last moments, what would your thoughts be about that?;I would take comfort.;I would be offended.;I would be indifferent.;Other thoughts would take precedence.;6
q42665;Would you consider dating someone who has chosen to completely abstain from drinking alcohol?;Yes.;No.;;;8
q82512;Do you like to listen to audiobooks?;Yes.;No.;I've never tried them.;;1
q12598;Can you name 5 directors and a film that each made, from before 1980?;Yes;No;;;
q55117;Imagine you are at a social event and your partner says something you disagree with strongly.  Which of the following would you most likely do?;I'd support them even though I disagree.;I'd just keep quiet.;I'd politely disagree.;I'd argue my point aggressively.;
q350;Do you have a really good relationship with both your parents?;Yes;No;;;
q19236;Is there a point in a relationship where it can get 'too serious'?;Yes;No;;;
q84036;Have you ever talked your way out of a traffic ticket?;Yes.;No.;;;
q49467;How do you feel about putting children on leashes?;I do not approve of this.;I approve of this.;I might approve under special circumtances.;I could not care less.;
q39639;Let's say a close friend told you something in confidence, but you subsequently stopped being friends with them. Do you feel free to share their secret with others?;Yes.;No.;Only if they had betrayed me.;;
q15172;Have you ever done something reckless that resulted in a major injury? (broken bones, etc.);Yes;No;;;
q460831;If you had the option to see your date naked before your first meeting, would you take it?;Yes;No;;;
q26144;Would it bother you if your boss was a minority, female, or gay?;Yes, one or more of those types bother me;Not really, but maybe;Not sure;No;
q7042;Do you tend to be attracted to people who remind you of old loves?;Yes;No;I've never loved;;
q46566;If you and a partner lived alone together, how much time would you spend naked while in your home?;All of the time.;More than half of the time.;Less than half of the time.;Never.;
q12950;Do you iron your own clothes?;Yes;No;;;
q487;Have you ever quit a job without giving at least a week notice?;Yes;No;;;
q25040;Do you ever daydream of performing a heroic feat or be dramatically rescued for/by the person of your dreams?;Yes;No;I'm Not Sure;;
q40484;Would you date someone, knowing that they had a VERY close family member (parent, sibling) who was openly gay?;Yes;No;I'm Not Sure;If they didn't flaunt it, it would be all right.;
q81171;Choose a romantic three day weekend with your significant other.;A fancy hotel.;A road trip to visit friends.;A camping trip.;Let's stay at home.;
q40846;If you're not, imagine that you are a virgin all over again.  Would you rather lose your virginity to another virgin or someone more experienced?;I'd want my first partner to be a virgin.;I'd want my first partner to be experienced.;Either would be equally fine.;Neither, I would prefer to remain a virgin.;
q77061;Which are you better at remembering, names or faces?;Names.;Faces.;;;
q28206;Do you talk in your sleep?;Yes / Sometimes;No / Very Rarely;I'm Not Sure / Maybe;;
q45758;Do you believe that religious-minded people are generally more moral?;Yes;No;Don't know / no opinion;;
q46218;Do you like to interpret your own dreams?;Yes.;No.;;;
q20471;What's the best conversation material for a first date?;Jobs, pets, hobbies;What you want out of a relationship;Goals, plans, wishes, hopes;Conversation?;
q32508;Do you know CPR?;Yes;No;Only the basics/never finished the course.;;
q46643;On a global scale, which do you believe provides the greater hindrance to world peace and unity?;Economics.;Religion.;;;
q17844;French new wave films?;Cool;Uncool;Huh?;;
q58622;Do you ever feel it is important to answer questions like these in certain denominations or multiples?  (e.g., You can't stop until you've answerd a multiple of 5 questions or the total number of questions you've answered ends in 2.);Yes.;No.;;;
q19664;If your 9 year old daughter was begging you to allow her to wear a thong, what would your response be?;Sure, why not?;Hell no.;I would consider it.;;
q1187;Break-ups. Which has happened more?;Usually I break up with them;Usually they break up with me;It's been equal on both sides.;;
q135;All else the same, would you rather date someone rich or hot?;Rich;Hot;;;
q47122;Who played the biggest role in raising you?;My mother.;My father.;Another relative.;Someone else.;
q59825;If you could take only one of the following on a road trip, which would it be?;A map.;A camera.;A companion.;A journal to write in.;
q29652;When it comes to music, do you have a strong preference for male or female vocals?;Yes - male vocals.;Yes - female vocals.;No, not really.;I prefer instrumental or non-vocal-driven music.;
q6123;How often do you send greeting cards for holidays and birthdays?;Always;Sometimes;Never;;
q23301;Are you scared of the future?;Yes, a lot;Yes, a little;No, not really;No, not at all;
q8142;Do you think it's okay for males to wear makeup?;Yes;No;;;
q56151;How would you react if your lover called you by the name of their ex?;I'd get mad and/or dump him/her.;I'd pretend I didn't hear.;I'd laugh about it/wouldn't really care.;I'd talk to him/her about it.;
q51197;When eating, do you generally eat the things you like most first or save them for last?;I eat the things I like most first.;I eat the things I like most last.;I don't usually eat in a particular order.;;
q40007;Imagine that you receive a document that absolutely proves whether or not God exists.  Upon reading the document and finding the truth, you must decide whether or not to share the proof with the world.  Which would you do?;Share the truth regardless of what it is.;Keep the truth to myself regardless of what it is.;Share only if it proves that God exists.;Share only if it proves that God does not exist.;
q461426;Which characteristic is most attractive in a date?;They're sleek, sophisticated and well-styled.;They're provocative, daring and unexpected.;They're sexy in a way I can't quite pin down... chalk it up to bedroom appeal.;;
q39147;Would you support assisted suicide/right-to-die legislation?;Yes.;No.;I don't know.;;
q55169;Do you think boys should be circumcised?;Yes.;No.;I'm not sure.;;
q49660;How many pictures of family and friends do you carry with you in your purse or wallet?;10 or more.;1 to 10.;None.;I don't carry a wallet or purse.;
q8038;If you want to get to the top of the stairs sooner, do you:;Skip steps;Go faster without skipping;;;
q356;Do you have any credit cards?;Yes;No;;;
q82124;Of the following, which is your preferred method for expressing love to a partner?;Physical touch.;Talking, words of affirmation.;Gifts and meaningful gestures.;Acts of service/devotion.;
q18569;Do you have rhythm (at least enough to find the beat of a song)?;Yes;No;I think so, but people tell me otherwise;;
q46301;Would you consider dating someone who is in the process of getting divorced?;Yes.;No.;;;
q24137;Are you willing to wear uncomfortable clothes to look good?;Absolutely not;On very special occasions;Sometimes;Usually yes;
q1850;What do you think of the prospect of having sexual intercourse while wearing some type of costume(fur-suit, sci-fi costume, clown suit, whatever).;Yes way;No way;;;
q64657;If you saw a really fantastic magic trick performed, would you want to know the secret behind how it was done?;Yes.;No.;;;
q111;Can you name any ballet other than the Nutcracker?;Yes;No;;;
q12551;Do you, or have you ever, read a text book or technical manual for fun/pleasure?;Yes;No;;;
q19820;Would you date someone with braces?;Yes, braces are hot!;I'm not sure.;No way!  How uncool.;;
q35078;Can you name five living poets and the title of one book by each?;Yes;No;Poets, but not titles;I can't even name five dead poets;
q82443;Did a parent or guardian ever actually wash your mouth out with soap?;Yes.;No.;;;
q37604;Do you believe that, when a soldier kills an enemy soldier in combat during a war, it is murder?;Yes.;No.;;;
q35399;What's the gender distribution of the vocalists in your music collection?;Mostly female singers.;Nearly the same male and female.;Mostly male singers.;I have little or no music collection with vocals.;
q137;Would you terminate a pregnancy if the baby was going to be mentally disabled?;Yes;No;It depends on the severity;;
q34511;Would you say you have...;A green thumb;A black thumb;A modicum of success with vegetation;Absolutely no interest in plants;
q19928;Honestly, did you ever torture a cat, dog, or any other furry animal for pleasure?;Yes, but I regret it.;NO WAY!;Yeah, that's fun.;No, but I would do it.;
q471;Do you know how to use a darkroom to develop negatives and prints?;Yes;No;;;
q46071;During conversation, do you gesticulate?;Yes.  Often.;No.  Never.;Perhaps occasionally.;I'm not sure.;
q21589;Would you consider dating someone who's never been in a relationship before?;Yes, that would be great;Yes, I think;I don't know, I don't think I could;No way!;
q946;Do you consider yourself to be good at clear verbal communication?;Yes;No;Sometimes;;
q80412;Do you own any cookbooks?;Yes.;No.;;;
q61487;If political candidates supported marijuana legalization, how would that affect your disposition toward voting for them?;I would be more likely to vote for them.;I would be less likely to vote for them.;This would not influence my vote.;;
q468;Do you like logic puzzles?;Yes;No;;;
q86615;Would you pay for porn?;Yes.;No.;Only if I couldn't get it for free.;I'm not interested in porn.;
q19784;When you draw a picture, write a poem, or otherwise do something creative, are you shy about letting other people see it?;Sometimes;Rarely;Often;If I'm still learning the required skills;
q6988;If someone sends you an e-mail (or has a profile) full of spelling and grammatical errors, are you less likely to talk to them?;Yes;No;;;
q15767;Would you be able to tell a Manet painting from a Monet painting?;Yes;No;What?;;
q55180;Do you often find that movies widely considered classics are really just over-rated?;Yes.;No.;;;
q18841;Would you date someone that you'd had a one night stand with?;Yes, but only if the sex had been good.;Yes, but only if I liked that person.;No.;;
q18759;How often do you wear underwear?;Always;Usually;Rarely;Never;
q18977;Do you believe in second chances when it comes to romantic relationships?;Yes, it may work out in another time/place.;No, it didn't work the first time, it never will;Depends on the relationship;;
q7535;Do you take pills when you have a headache?;Yes;No;;;
q459194;Do you have a favorite scent?;Yes, and it doesn't change.;Yes, but I change it every once in awhile.;No, but I'm searching for one.;No.;
q85974;If there were a political candidate who you really liked, how would you offer support in terms of time or money?;I'd devote time to work on the campaign.;I'd donate money or other tangible resources.;I'd do both of the above.;I'd do none of the above.;
q54065;If medical science completely eliminated all sexually transmitted disease, how would this affect who you would have sex with?;I would have sex with MANY more people.;I would have sex with more people.;It would not affect who I have sex with.;I would have sex with fewer people.;
q1100;Are you better looking than most people?;Yes;No;;;
q59279;When you are feeling down or blue, which is most comforting to you?;Food.;Sex.;Exercise.;Music.;
q96;Are you, or have you ever been, in a band?  (A solo act is fine, too. Don't count school bands.);Yes;No;;;
q39682;Do you have a good imagination?;Yes.;No.;;;
q24013;Consciousness is...;Biological - Brain, senses.;Spiritual - Soul, heart, spirit.;A good topic for debate, my answer is too long.;A big, scary word.;
q12954;Do you have a thing for foreign accents?;Yes;No;;;
q21896;Do you enjoy flowers?;Yes;No;Flowers are a waste of time;;
q164;Do you wear a suit to work (or female equivalent)?;Yes;No;;;
q51349;Is it possible for your partner to be too ambitious?;Yes.;No.;;;
q52431;Have you made plans to survive a natural or man-made disaster where you live?;Yes.;No.;;;
q46252;Have you performed in a theater setting as an adult?;Yes, as a professional.;Yes, as a student.;Yes, as a hobby.;No.;
q35600;Do you read in the bathroom?;Yes, usually.;No, never.;Sometimes.;;
q34929;Is it okay for someone to try and influence their romantic partner's appearance or clothing?;Couples should try to look pleasing for each other;As long as it's not extreme and they ask nicely;They shouldn't try to change their partner.;Demands create weird power struggles.;
q79708;Have you ever purposely pretended to be ignorant about something you have knowledge of because you wanted to hear someone else explain it?;Yes.;No.;;;
q14928;Can you read sheet music?;Yes;No;;;
q34679;You're early in a relationship and your significant other begins crying.  You have no idea what prompted it.  What do you do?;Gently prompt them to talk with me.;Remain quiet and open to discussion if requested.;Begin edging slowly toward the door.;Sigh exasperatedly.  Why me?;
q23439;What is your opinion about softcore pornography magazines such as Playboy and Playgirl?;Shows the beauty of the human body;Degrading to the models;Doesn't matter to me;;
q53426;When you have plans to meet someone at a certain time, it's best to be:;A little early.;A little late.;Precisely on time.;Whatever.;
q20145;Do you like to celebrate holidays?;Yes, I like to.;No, I don't like to;Depends which holiday it is;I have no preference;
q110;Can you name 5 operas, and their composers?;Yes;No;;;
q85076;What portion of your friends are citizens of a country other than your own?;All or most.;Many.;One, two or a few.;None.;
q564;Can you name five current world leaders?;Yes;No;;;
q82307;Has anyone ever pressured you to marry them and failed?;Yes.;No.;;;
q81504;Do you chew tobacco?;Yes.;No.;;;
q20036;When deciding what is right and wrong you are:;more emotional;more logical;Religion/faith determines it.;I am not sure/other reasons.;
q36695;Which is your preferred method of learning?;Traditional classroom;Computer-based instruction;Self study / reading;Other;
q525;Do you play any musical instruments?;Yes;No;;;
q50953;If someone murdered a close friend of yours, would you hope for the death penalty?;Yes.;No.;I'm not sure.;;
q59456;Would you consider dating a psychiatrist?;Yes.;No.;;;
q38623;Have you ever 'regifted' a gift you didn't like?;Yes.;No.;;;
q187;In high school, were you one of the 'cool' kids?;Yes;No;;;
q32632;When cooking food in the microwave, do you often impatiently hit the cancel button within the last few seconds rather than waiting?;Yes;No;I don't have/use a microwave;;
q30564;When facing a complicated situation, can you easily put yourself in another person's shoes and consequently see things from his or her point of view?;Yes;No;Sometimes;;
q344;Do most politicians really want to make the world a better place?;Yes;No;;;
q38653;Do you crack your knuckles?;Yes.;No.;;;
q19690;Would you date someone who used to have a problem with cutting themselves and have scars to prove it?;Yes;No;I'm Not Sure;;
q369;Which would you rather drive?;A fast sports car;An SUV;Something more environmentally friendly;;
q82428;When taking a cab, do you like talking to the driver?;Yes.;No.;I'm not sure.;;
q489;Have you ever been fired from a job?;Yes;No;;;
q254;Have you ever skied, snowboarded, surfed, or wind-surfed?;Yes;No;;;
q26204;Hypothetically, if you had an unwanted child on the way, what would you do?;Abort it;Give it up for Adoption;Keep it regardless;;
q61830;Should cigarettes be illegal?;Yes.;No.;;;
q18789;Would you prefer a daughter or a son?;Daughter;Son;Indifferent;Neither;
q49907;Might you be embarrassed if your 'offline' friends found your OkCupid profile?;Yes.;No.;;;
q47666;Do you ever rehearse or plan conversations before actually having them?;Yes.;No.;;;
q41112;Have you ever written short fiction, other than for school assignments?;No.;I've tried, but never finished a story.;I've finished at least one short story.;I've written many short stories.;
q342;Do you like stand-up comedy?;Yes;No;;;
q46455;Do you think most people your age would guess what kinds of music you listen to or don't listen to just by looking at you?;Yes.;No.;;;
q459187;How often do you wear cologne or perfume?;Every day;3 times a week;Once or twice a week;Never;
q889;Do you prefer to pursue a potential partner, or for them to pursue you?;I'd rather pursue.;I'd rather be pursued.;I prefer a little of both.;;
q36465;You have plans to hang out with some friends, but a person you have recently begun dating calls and asks you to do something for the night.  Assuming you are still interested in this person, what do you say?;Yes.  I'll see my friends another time.;No, I'm busy.  How about another time?;Sure, but let's hang out with my friends.;I'll do both somehow, but keep them separated.;
q68818;If you hooked up with someone and a pregnancy unexpectedly resulted, would you feel that you should get married?;Yes.;No.;;;
q68437;If while visiting a friend's house, you notice a painting hanging slightly off kilter.  Do you adjust it?;Yes.;No.;;;
q34641;Do you use 'Jesus Christ' or 'God damn it' when you curse?;Yes;Yes, but I regret it.;No.;I do not curse at all.;
q249;Could you do 25 pushups without stopping?;Yes;No;;;
q18648;Are you accepting of other people?;I'm highly benevolent;I'm selective;I'm fussy;I'm a hard-nosed bastard;
q36654;What is your favorite transportation medium?;Land (trains, buses, cars, bikes, feet, etc.);Sea (ships, boats, submarines, etc.);Air (airplanes, rockets, dirigibles, etc.);Other.;
q28758;You read a personal ad and it is misspelled, with poor grammar and uncertain capitalization. Do you allow that to affect your opinion of the person?;Yes;No;Maybe / Unsure;;
q58063;Do you currently subscribe to any pay-for-play online games?;Yes.;No.;;;
q8891;Do you enjoy learning about other cultures?;Yes;No;;;
q35536;Upon ending relationships and becoming single, have you made special efforts to get into shape and/or improve your physical appearance.;Yes.  Always.;After some, but not all, of my relationships.;No.  Never.;I've never ended a relationship.;
q46873;Did you have childhood heroes?  If so, were they real people or fictional characters?;No, I did not have a childhood hero.;Real people.;Fictional characters.;Both.;
q85327;Do you listen to podcasts?;Yes, frequently.;Yes, once in a while.;No.;;
q81589;If a significant other decided s/he wanted to have or adopt six children with you, would this be okay?;Yes.;No.;Possibly, depending on the situation.;;
q83841;Do you enjoy taking pictures of yourself?;Yes.;No.;I'm not sure.;;
q45717;If your partner were to provide you with a meal, which would you appreciate more?;My partner cooking my favourite meal.;My partner taking me to my favorite restaurant.;Neither - I would appreciate both equally.;;
q347;Would you, or did you, go to your 10-year high school reunion?;Yes;No, but I wanted to;No;;
q140;If you had to guess, do you think humans will go extinct in the next 1000 years?;Yes;No;;;
q21709;When you are at the movies with your date or your friends, how much talking does it take to make you upset?;No talking allowed upon the start of the film;Talking during and usually about the trailers;Little comments during the movie.;Constant chatter, to you, others, or a cell phone;
q47799;Which of the following would you most expect to determine from a first date?;Sexual compatibility.;Emotional compatibility.;Spiritual compatibility.;Financial compatibility.;
q30455;Should drugs be legalized, regulated, and taxed?;Yes;No;I'm Not Sure;;
q332;Would you ever date someone who's had cosmetic surgery?;Yes;No;;;
q45238;Have ever performed CPR on a real person?;Yes.;No, but I've been trained to.;No, and I don't know how to.;;
q15618;When you see something on sale that's buy one, get one free, does it make you want to buy it even if you don't need it?;Yes;No;;;
q18837;Someone is staring at you, and you notice. Do you:;Stare back intensely until he/she looks away?;Look away first, or immediately?;Raise an eyebrow (or two)?;Say something lame? 'Take a picture...';
q199;Do you know the square root of 256 off the top of your head?;Yes;No;;;
q40851;Imagine that a first date picks you up in a car.  The car is old and run-down, but otherwise clean.  How would the car affect your opinion of your date?;Positively - Any car is good.;Negatively - I don't like riding in old jalopies.;Could go either way, depending on the make/model.;Not at all - It's all about the driver.;
q48918;How would you feel about a partner self-stimulating while you are performing oral sex?;Insulted.;Excited.;Indifferent.;I'm not sure.;
q70863;Have you ever stayed up all night, until dawn, talking with someone you have just met?;Yes.;No.;;;
q166;Politically, which way do you lean?;To the right (republican in the US);To the left (democrat in the US);To the middle / I don't know;;
q172;Would you fight for your country in an unjust war?;Yes;No;;;
q28741;Can you write a web site in HTML (without using site building software)?;Yes;No;;;
q36345;If an otherwise perfect match gave you an ultimatum to become a vegetarian, what would you do?;Comply - Become a vegetarian.;Rebel - This would be a deal breaker.;Smile - I'm already a vegetarian.;;
q18670;Are you a member of the Society for Creative Anachronism (SCA)?;No;No, but sounds interesting.;Yes;;
q60765;When it comes to right and wrong, which of the following do you think has the greatest impact on your belief system?;Religion.;Family and/or friends.;Laws.;Self interest.;
q18247;Can you identify a French Manicure?;Yes;No;I'm Not Sure;What is a manicure?;
q19566;Would you consider dating a High School dropout?;Yes;Yes, if they are doing well;No;;
q20745;From which medium are you most likely to find out about new news stories?;Television;Newspaper;Radio;Online;
q435;Did you ever study Latin, Ancient Greek, or any other dead language, for at least a year?;Yes;No;;;
q27173;Do you get along well with shy and socially awkward people?;Yes;No;;;
q53155;Do you enjoy gardening?;Yes.;No.;I'm not sure.;;
q26469;Have you ever tasted your own sexual fluids?;Yes;No, and I would never;No, but I would;;
q34149;Do you feel you were born in the correct era/time period?;Yes, I love the current times!;No, I should've been born in the future.;No, I should've been born in the recent past.;No, I should've been born in the distant past.;
q46740;If it were possible to change your gender instantly, painlessly, reversibly, and for free, would you?;Yes.;No.;;;
q461423;Is it possible for your partner to reveal too much information?;Yes, I prefer a little bit of mystery.;Maybe, I want to know all the important stuff.;No, I want to know everything... especially the provocative stuff.;;
q19088;Do you believe there are only two genders?;Yes;No;I'm Not Sure;;
q14884;Would you date someone significantly (9 years or over) older than you?;Yes;No;I'm Not Sure;;
q42839;Which of the following learning approaches would you prefer?;Doing and figuring it out myself.;Watching someone else do it.;Listening to someone explain how it's done.;Reading about how it should be done.;
q38202;'The best days of my life' are:;In my future.;In my past.;Right now.;;
q312;Are you likely to make long, friendly conversation with strangers?;Yes;No;;;
q85813;If your significant other actively participates in an activity that you are not really interested in, would you go to offer support if they wanted you to?;Yes, as often as I could.;Yes, I'd go occasionally.;Maybe once or twice, to say I did.;No, I would not.;
q48508;If you were buying a house or apartment to live in, how important would quiet be to you?;Very important.;Somewhat important.;Not important.;;
q26300;Do people tend to take you seriously, or usually think you're being sarcastic?;Serious;Sarcastic;;;
q6018;Do you enjoy chatting on the phone with your friends?;Yes;No;;;
q18714;Which of these do you use/consult the MOST when making decisions?;Mysticism/Religion/Higher Power;Emotion/Instinct;Logic/Reason;Random Chance;
q60380;If you discovered upon death that you must reincarnate into an animal, but are only allowed a broad choice as follows, which would you select?;An animal that lives on land.;An animal that lives in the water.;An animal that can fly.;;
q19832;Would you consider attending the wedding of a relative you haven't seen since childhood?;Yes, no matter what.;No, they're not a part of my life anymore.;Depends on the circumstances. Distance, time, etc;;
